{
  "schema_version": 1,
  "adapter_id": "homeocta",
  "adapter_version": "0.6.1",
  "sdk_contract_version": "1.0.0",
  "capabilities": [
    "browser.read",
    "document.training"
  ],
  "config_schema_ref": "contracts/platform-adapter-config.schema.json",
  "secret_refs": [],
  "simulation_supported": true
}
